names_original,names_wo_authors,Genus,Epithet,Anything_else,empty,scientificName_status,scientificName_new
"Diplasiolejeunea cubatensis R. Prudêncio, Z.R. Mello & D.P. Costa",Diplasiolejeunea cubatensis Costa,Diplasiolejeunea,cubatensis,Costa,FALSE,name_w_wrong_case,Diplasiolejeunea cubatensis costa
"Borreria apodiensis E.L. Cabral,L.M. Miguel & E.B. Souza",Borreria apodiensis Souza,Borreria,apodiensis,Souza,FALSE,name_w_wrong_case,Borreria apodiensis souza
Connarus manausensis C. Toledo & V. C. Souza,Connarus manausensis Souza,Connarus,manausensis,Souza,FALSE,name_w_wrong_case,Connarus manausensis souza
Connarus ramiflorus C. Toledo & V. C. Souza,Connarus ramiflorus Souza,Connarus,ramiflorus,Souza,FALSE,name_w_wrong_case,Connarus ramiflorus souza
"Borreria minensis E.L. Cabral, L.M. Miguel & E.B. Souza",Borreria minensis Souza,Borreria,minensis,Souza,FALSE,name_w_wrong_case,Borreria minensis souza
"Sciodaphyllum asymmetricum (Frodin) Lowry, G.M. Plunkett & M.M. Mora",Sciodaphyllum asymmetricum Mora,Sciodaphyllum,asymmetricum,Mora,FALSE,name_w_wrong_case,Sciodaphyllum asymmetricum mora
"Sciodaphyllum concolor (Frodin) Lowry, G.M. Plunkett & M.M. Mora",Sciodaphyllum concolor Mora,Sciodaphyllum,concolor,Mora,FALSE,name_w_wrong_case,Sciodaphyllum concolor mora
"Sciodaphyllum duidae (Steyerm.) Lowry, G.M. Plunkett & M.M. Mora",Sciodaphyllum duidae Mora,Sciodaphyllum,duidae,Mora,FALSE,name_w_wrong_case,Sciodaphyllum duidae mora
"Sciodaphyllum monospermum (Maguire, Steyerm. & Frodin) Lowry, G.M. Plunkett & M.M. Mora",Sciodaphyllum monospermum Mora,Sciodaphyllum,monospermum,Mora,FALSE,name_w_wrong_case,Sciodaphyllum monospermum mora
"Sciodaphyllum tremuloideum (Maguire, Steyerm. & Frodin) Lowry, G.M. Plunkett & M.M. Mora",Sciodaphyllum tremuloideum Mora,Sciodaphyllum,tremuloideum,Mora,FALSE,name_w_wrong_case,Sciodaphyllum tremuloideum mora
